<?xml version="1.0" encoding="UTF-8"?>
<urt_map_import 
        xmlns:xsi="http://www.w3.org/2001/XMLSchema-instance"
        xsi:noNamespaceSchemaLocation="import_maps.xsd">
  <maps>
    <map>
      <fileName>blackbridge</fileName>
      <type>MEDIUM</type>
      <images>
        <image><contentURL>file:///home/ghost/projects/urt-stats/.unversioned/maps/blackbridge_01.jpg</contentURL></image>
        <image><contentURL>file:///home/ghost/projects/urt-stats/.unversioned/maps/blackbridge_02.jpg</contentURL></image>
      </images>
    </map>
    <map>
      <fileName>ut4_abbey</fileName>
      <type>MEDIUM</type>
      <images>
        <image><contentURL>file:///home/ghost/projects/urt-stats/.unversioned/maps/ut4_abbey_01.jpg</contentURL></image>
        <image><contentURL>file:///home/ghost/projects/urt-stats/.unversioned/maps/ut4_abbey_02.jpg</contentURL></image>
        <image><contentURL>file:///home/ghost/projects/urt-stats/.unversioned/maps/ut4_abbey_03.jpg</contentURL></image>
      </images>
    </map>
    <map>
      <fileName>ut4_abbeyctf</fileName>
      <type>LARGE</type>
      <images>
        <image><contentURL>file:///home/ghost/projects/urt-stats/.unversioned/maps/ut4_abbeyctf_01.jpg</contentURL></image>
        <image><contentURL>file:///home/ghost/projects/urt-stats/.unversioned/maps/ut4_abbeyctf_02.jpg</contentURL></image>
        <image><contentURL>file:///home/ghost/projects/urt-stats/.unversioned/maps/ut4_abbeyctf_03.jpg</contentURL></image>
      </images>
    </map>
    <map>
      <fileName>ut4_algiers</fileName>
      <type>MEDIUM</type>
      <images>
        <image><contentURL>file:///home/ghost/projects/urt-stats/.unversioned/maps/ut4_algiers_01.jpg</contentURL></image>
        <image><contentURL>file:///home/ghost/projects/urt-stats/.unversioned/maps/ut4_algiers_02.jpg</contentURL></image>
        <image><contentURL>file:///home/ghost/projects/urt-stats/.unversioned/maps/ut4_algiers_03.jpg</contentURL></image>
      </images>
    </map>
    <map>
      <fileName>ut4_blackhawk</fileName>
      <type>MEDIUM</type>
      <images>
        <image><contentURL>file:///home/ghost/projects/urt-stats/.unversioned/maps/ut4_blackhawk_01.jpg</contentURL></image>
        <image><contentURL>file:///home/ghost/projects/urt-stats/.unversioned/maps/ut4_blackhawk_02.jpg</contentURL></image>
        <image><contentURL>file:///home/ghost/projects/urt-stats/.unversioned/maps/ut4_blackhawk_03.jpg</contentURL></image>
      </images>
    </map>
    <map>
      <fileName>ut4_blitzkrieg2_bots</fileName>
      <type>MEDIUM</type>
      <images>
        <image><contentURL>file:///home/ghost/projects/urt-stats/.unversioned/maps/ut4_blitzkrieg2_bots_01.jpg</contentURL></image>
        <image><contentURL>file:///home/ghost/projects/urt-stats/.unversioned/maps/ut4_blitzkrieg2_bots_02.jpg</contentURL></image>
        <image><contentURL>file:///home/ghost/projects/urt-stats/.unversioned/maps/ut4_blitzkrieg2_bots_03.jpg</contentURL></image>
      </images>
    </map>
    <map>
      <fileName>ut4_blitzkrieg_bots</fileName>
      <type>MEDIUM</type>
      <images>
        <image><contentURL>file:///home/ghost/projects/urt-stats/.unversioned/maps/ut4_blitzkrieg_bots_01.jpg</contentURL></image>
        <image><contentURL>file:///home/ghost/projects/urt-stats/.unversioned/maps/ut4_blitzkrieg_bots_02.jpg</contentURL></image>
        <image><contentURL>file:///home/ghost/projects/urt-stats/.unversioned/maps/ut4_blitzkrieg_bots_03.jpg</contentURL></image>
      </images>
    </map>
    <map>
      <fileName>ut4_bohemia</fileName>
      <type>LARGE</type>
      <images>
        <image><contentURL>file:///home/ghost/projects/urt-stats/.unversioned/maps/ut4_bohemia_01.jpg</contentURL></image>
        <image><contentURL>file:///home/ghost/projects/urt-stats/.unversioned/maps/ut4_bohemia_02.jpg</contentURL></image>
        <image><contentURL>file:///home/ghost/projects/urt-stats/.unversioned/maps/ut4_bohemia_03.jpg</contentURL></image>
      </images>
    </map>
    <map>
      <fileName>ut4_city6_bots</fileName>
      <type>MEDIUM</type>
      <images>
        <image><contentURL>file:///home/ghost/projects/urt-stats/.unversioned/maps/ut4_city6_bots_01.jpg</contentURL></image>
        <image><contentURL>file:///home/ghost/projects/urt-stats/.unversioned/maps/ut4_city6_bots_02.jpg</contentURL></image>
        <image><contentURL>file:///home/ghost/projects/urt-stats/.unversioned/maps/ut4_city6_bots_03.jpg</contentURL></image>
      </images>
    </map>
    <map>
      <fileName>ut4_commune</fileName>
      <type>MEDIUM</type>
      <images>
        <image><contentURL>file:///home/ghost/projects/urt-stats/.unversioned/maps/ut4_commune_01.jpg</contentURL></image>
        <image><contentURL>file:///home/ghost/projects/urt-stats/.unversioned/maps/ut4_commune_02.jpg</contentURL></image>
        <image><contentURL>file:///home/ghost/projects/urt-stats/.unversioned/maps/ut4_commune_03.jpg</contentURL></image>
      </images>
    </map>
    <map>
      <fileName>ut4_crazychristmas</fileName>
      <type>LARGE</type>
      <images>
        <image><contentURL>file:///home/ghost/projects/urt-stats/.unversioned/maps/ut4_crazychristmas_01.jpg</contentURL></image>
        <image><contentURL>file:///home/ghost/projects/urt-stats/.unversioned/maps/ut4_crazychristmas_02.jpg</contentURL></image>
        <image><contentURL>file:///home/ghost/projects/urt-stats/.unversioned/maps/ut4_crazychristmas_03.jpg</contentURL></image>
      </images>
    </map>
    <map>
      <fileName>ut4_eyasarcade</fileName>
      <type>TINY</type>
      <images>
        <image><contentURL>file:///home/ghost/projects/urt-stats/.unversioned/maps/ut4_eyasarcade_01.jpg</contentURL></image>
        <image><contentURL>file:///home/ghost/projects/urt-stats/.unversioned/maps/ut4_eyasarcade_02.jpg</contentURL></image>
        <image><contentURL>file:///home/ghost/projects/urt-stats/.unversioned/maps/ut4_eyasarcade_03.jpg</contentURL></image>
      </images>
    </map>
    <map>
      <fileName>ut4_facade_b5a</fileName>
      <type>MEDIUM</type>
      <images>
        <image><contentURL>file:///home/ghost/projects/urt-stats/.unversioned/maps/ut4_facade_b5a_01.jpg</contentURL></image>
        <image><contentURL>file:///home/ghost/projects/urt-stats/.unversioned/maps/ut4_facade_b5a_02.jpg</contentURL></image>
        <image><contentURL>file:///home/ghost/projects/urt-stats/.unversioned/maps/ut4_facade_b5a_03.jpg</contentURL></image>
      </images>
    </map>
    <map>
      <fileName>ut4_inferno_b3</fileName>
      <type>MEDIUM</type>
      <images>
        <image><contentURL>file:///home/ghost/projects/urt-stats/.unversioned/maps/ut4_inferno_b3_01.jpg</contentURL></image>
        <image><contentURL>file:///home/ghost/projects/urt-stats/.unversioned/maps/ut4_inferno_b3_02.jpg</contentURL></image>
        <image><contentURL>file:///home/ghost/projects/urt-stats/.unversioned/maps/ut4_inferno_b3_03.jpg</contentURL></image>
      </images>
    </map>
    <map>
      <fileName>ut4_iran3</fileName>
      <type>SMALL</type>
      <images>
        <image><contentURL>file:///home/ghost/projects/urt-stats/.unversioned/maps/ut4_iran3_01.jpg</contentURL></image>
        <image><contentURL>file:///home/ghost/projects/urt-stats/.unversioned/maps/ut4_iran3_02.jpg</contentURL></image>
        <image><contentURL>file:///home/ghost/projects/urt-stats/.unversioned/maps/ut4_iran3_03.jpg</contentURL></image>
      </images>
    </map>
    <map>
      <fileName>ut4_iran3_u1</fileName>
      <type>SMALL</type>
      <images>
        <image><contentURL>file:///home/ghost/projects/urt-stats/.unversioned/maps/ut4_iran3_u1_01.jpg</contentURL></image>
        <image><contentURL>file:///home/ghost/projects/urt-stats/.unversioned/maps/ut4_iran3_u1_02.jpg</contentURL></image>
        <image><contentURL>file:///home/ghost/projects/urt-stats/.unversioned/maps/ut4_iran3_u1_03.jpg</contentURL></image>
      </images>
    </map>
    <map>
      <fileName>ut4_metro_beta1</fileName>
      <type>LARGE</type>
      <images>
        <image><contentURL>file:///home/ghost/projects/urt-stats/.unversioned/maps/ut4_metro_beta1_01.jpg</contentURL></image>
        <image><contentURL>file:///home/ghost/projects/urt-stats/.unversioned/maps/ut4_metro_beta1_02.jpg</contentURL></image>
        <image><contentURL>file:///home/ghost/projects/urt-stats/.unversioned/maps/ut4_metro_beta1_03.jpg</contentURL></image>
      </images>
    </map>
    <map>
      <fileName>ut4_nepal</fileName>
      <type>MEDIUM</type>
      <images>
        <image><contentURL>file:///home/ghost/projects/urt-stats/.unversioned/maps/ut4_nepal_01.jpg</contentURL></image>
        <image><contentURL>file:///home/ghost/projects/urt-stats/.unversioned/maps/ut4_nepal_02.jpg</contentURL></image>
        <image><contentURL>file:///home/ghost/projects/urt-stats/.unversioned/maps/ut4_nepal_03.jpg</contentURL></image>
      </images>
    </map>
    <map>
      <fileName>ut4_paris_v2</fileName>
      <type>MEDIUM</type>
      <images>
        <image><contentURL>file:///home/ghost/projects/urt-stats/.unversioned/maps/ut4_paris_v2_01.jpg</contentURL></image>
        <image><contentURL>file:///home/ghost/projects/urt-stats/.unversioned/maps/ut4_paris_v2_02.jpg</contentURL></image>
        <image><contentURL>file:///home/ghost/projects/urt-stats/.unversioned/maps/ut4_paris_v2_03.jpg</contentURL></image>
      </images>
    </map>
    <map>
      <fileName>ut4_prague_v2</fileName>
      <type>MEDIUM</type>
      <images>
        <image><contentURL>file:///home/ghost/projects/urt-stats/.unversioned/maps/ut4_prague_v2_01.jpg</contentURL></image>
        <image><contentURL>file:///home/ghost/projects/urt-stats/.unversioned/maps/ut4_prague_v2_02.jpg</contentURL></image>
        <image><contentURL>file:///home/ghost/projects/urt-stats/.unversioned/maps/ut4_prague_v2_03.jpg</contentURL></image>
      </images>
    </map>
    <map>
      <fileName>ut4_slumwar</fileName>